,Unnamed: 0,artist,lyrics,tag,title,x_coordinate,y_coordinate,year
668,669,Lutha,"Stop! hey now, the music is over
Stop! hey now, it's over, it's over
Stop! hey now, the music is over
Stop!

Who are we to feel so free
All of the sorrow
You know it ain't right
You and me yeah
He and she
Got to get out and stop all this fight
I said...

Stop! hey now, the music is over
Stop! hey now, it's over, it's over
Stop! hey now, the music is over
Stop!

Many try to, philosophize
All of our troubles
And say we're uptight
But in the end they, crucify
The tune they sing does not shed any light
I said...
Stop! hey now, the music is over
Stop! hey now, it's over, it's over
Stop! hey now, the music is over
Stop!

Got to spend my time yeah, spend my time
Not making music not singing this song
But who am I to identify
For you know it's wrong you know it's wrong
I said...

Stop! hey now, the music is over
Stop! hey now, it's over, it's over
Stop! hey now, the music is over
Stop! hey now, it's over, it's over

Stop! hey now, the music is over
Stop! hey now, it's over, it's over
Stop! hey now, the music is over

Stop! hey now, the music is over
Stop! hey now, it's over, it's over
Stop! hey now, the music is over
Stop! hey now, it's over, it's over

Stop! hey now, the music is over
Stop! hey now, it's over, it's over
Stop! hey now, the music is over",pop,Stop The Music Is Over,-0.6,0.6,2015
673,674,Your Favorite Martian,"[Verse 1: Puff Puff Humbert]

Have you ever felt left out of the group, excluded?
Given the boot when you knew you should have been a shoe-in, like
Some ancient Druid was pursuant to ruin your life
With a curse but worse, he brought his whole damn crew in

And now it’s high noon and you’re a target to shoot at
This school’s a battlefield, no wonder you’re truant
They always look at you and they boo at what you’re doing
And you go off like a bomb at the Olympics in Munich

Nah, you’re just an extraterrestrial
Less than respectable
You’ll never get to get the girl

You’re just a jester at the festival
I guess it’s acceptable
To peg your head with vegetables
And kick you in the testicles
And best of all let you know that you’re a filthy dog
And you’ll never be best in show
So why the abuse?
‘Cause all a bully needs is another excuse
[Chorus: Benatar]

Planet Earth, I need a friend
‘Cause I’m on the outside looking in
I’m an Alien
I’m just an Alien

Feeling lost but never found
‘Til I found myself being pushed around
I’m an alien
Yes, I’m an alien

[Verse 2: Puff Puff Humbert]

I’ma be honest, it gets better, I promise
So don’t let them ground you down to a pound of sawdust
Stay on the stage the longest ’til the gong hits and everybody comments
On their fondness of your polish and your overall knowledge

Remain calmest and abolish your modesty
‘Cause honestly you got to be positive, you’re a prodigy
You show the world that you’re not to mess with
It’s a broken home that makes these bastards aggressive

You can expect to get rejected
Neglected, stripped naked, and tested until they reckon
You feel terrible because nothing is comparable
Violence ain’t the answer but the pain is unbearable
You’re nice and jaded from being isolated
Now you coast through life feeling twice as hated
So why the abuse?
‘Cause all a bully needs is another excuse

[Interlude: Puff Puff Humbert]

Take it home Benatar

[Chorus: Benatar]

Well Planet Earth, I need a friend
‘Cause I’m on the outside looking in
I’m an alien
I’m just an alien

Oh, feeling lost but never found
‘Til I found myself being pushed around
I’m an alien
Yes, I’m an alien

Oh-oh-oh-oh
I'm an alien
Yes, I'm an alien
Oh-oh",pop,Alien Unplugged,-0.8,-0.4,2012
674,675,Delanie,"[Verse]
Hear me out, I'm so tired of arguing
Never know, when you're gone will you be home again?
You think too loud
I can't slow down

[Pre-Chorus]
I've never hated someone and worried so much at the same time
I've never worked so hard and still missed the deadline

[Chorus]
Will this ever be easy?
I'm trying to find my way
To find the words to say
That I don't know how to love you
I don't know how to
I don't know how to love you
I don't know how to love you

[Verse]
You look so proud, I don't know who you are
You can't be in someone's life without leaving a scar
Figure it out
I'm leaving now
[Pre-Chorus]
I've never hated someone and worried so much at the same time
I've never worked so hard and still missed the deadline
I never told you if I thought you were losing your mind
Cause I think I am too
And it might be because of you

[Chorus]
Will this ever be easy?
I'm trying to find my way
To find the words to say
That I don't know how to love you
Will this ever be easy?
I'm trying to find my way
To find the words to say
That I don't know how to love you

Will this ever be easy?
(I don't know how to)
I'm trying to find my way
(I don't know how to love you)
To find the words to say
(I don't know how to love you)
That I don't know how to love you
Will this ever be easy?
(I don't know how to)
I'm trying to find my way
(I don't know how to love you)
To find the words to say
That I don't know how to love you",pop,I Dont Know How to Love You,-0.7,0.6,2020
681,682,Backseat Goodbye,"You said the sun's too bright. So reached up and tore that bastard from the sky. You said the moon doesn't make sense. So grabbed it tight and drowned it in the ocean. Hush now love, the end has just begun. We're bored but alive. We live then we die. Infinity's a tragedy, we're all just playing along. Let's make this last, since we can't go back. Let's make this last, since we can't go back",pop,An Attempt To Forget,-0.8,-0.5,2008
684,685,Jeremiah Neil,"Verse One
I love it and I hate it
On my mind 25/8 days a week
You walk by, I can't take it
Got the juice, got the sauce, everything I need
You look good, I wish you could
Live the life that I picture with me
Whatchu doin’s calculated
And I give you permission to press my buttons, you see


Pre-Chorus
Running round got my head in shambles
Chase your fire, It's too hard to handle
Yeah I try to getaway
But I know one thing is true, boo

Chorus
All I care about is you babe
No, I'll never let this fall apart
Cause I wanna be with you babe
I’mma be there till the end so you ‘member from the start
Grab your bags, let's ghost
Cruising down the coast
I got some things I wanna show
Just ghost

Verse Two
Got my mind on vacation
Going London to Prague, anywhere don't care
Disregard determination
Enchant my mind, wanderlust, yeah you know that ain't fair
You look good, I know I could
Upgrade your vibe give us something to share
Normally not this patient
But I'll do what it do just to make it clear

Pre-Chorus
Running round got my head in shambles
Chase your fire, It's too hard to handle
Yeah I try to getaway
But I know one thing is true, boo

Chorus
All I care about is you babe
No, I'll never let this fall apart
Cause I wanna be with you babe
I'mma be there till the end so you ‘member from the start
Grab your bags, let’s ghost
Cruising down the coast
I got some things I wanna show
Just ghost

Post Chorus
Yeah, me like it, I like it
(All I wanna do is feel that body body on me)
Don’t you stop it, yeah, I want it
(All you need to do is put that body body on me)
Yeah, me like it, I like it
(All I wanna do is feel that body body on me)
Don't you stop it, yeah, I want it
(All you need to do is put that body body on me)

Pre-Chorus
Running round got my head in shambles
Chase your fire, It’s too hard to handle
Yeah I try to getaway
But I know one thing is true, boo

Chorus
All I care about is you babe
No, I'll never let this fall apart
Cause I wanna be with you babe
I'mma be there till the end so you ‘member from the start
Grab your bags, let's ghost
Cruising down the coast
I got some things I wanna show
Just ghost

Post Chorus
Yeah, me like it, I like it
(All I wanna do is feel that body body on me)
Don’t you stop it, yeah, I want it
(All you need to do is put that body body on me)
Yeah, me like it, I like it
(All I wanna do is feel that body body on me)
Don't you stop it, yeah, I want it
(All you need to do is put that body body on me)",pop,Ghost,0.6,0.9,2019
693,694,Miss Mango,"[Verse 1:]
Broke the cup gave it up had some luck
Seen split glass I've seen it pass
Still I know this is gonna last
Hold the times that we had on a silver plate
Put a nicely woven carpet over the dirt
Still I know this is gonna last

[Refrain:]
Hidden goldmine situations
Is it that you and I will hold the diamonds?
Silent sunrise situations
Is it that you and I will hold the diamonds?

[Verse 2:]
Digging deep though it's steep spread the seeds
To proceed and find out what we need
We made our way through the troubled past
Put our dreams on a pillow and let them rest
We'll shake and wake them
When our paths cross again
[Refrain x2:]
Hidden goldmine situations
Is it that you and I will hold the diamonds?
Silent sunrise situations
Is it that you and I will hold the diamonds?
Hidden treasure situations
Is it that you and I will hold the diamonds?
Quiet sunrise situations
Is it that you and I will hold the diamonds?",pop,Diamonds,0.7,-0.5,2014
695,696,Clover The Girl,"Misplaced
Headspace
Late on my rent with a straight face
Nobody can get ahold of me 'til I get hold of myself

Stay home
Syndrome
Drink a little bit what's the problem?
Nobody can get ahold of me 'til I get hold of myself
You don't feel what I'm feeling
You don't

Sorry, cause I don't know who I am anymore
Sorry, my emotions got me chained to the floor, the floor
I want to be what you want
I want to be what you need
But I don't know who I am anymore
I'm a little insecure

Stranger
Danger
New face every day in the mirror
Nobody can get ahold of me 'til I get hold of mysеlf
You don't feel what I'm feeling
You don't
Sorry, cause I don't know who I am anymore
Sorry, my emotions got mе chained to the floor, the floor
I want to be what you want
I want to be what you need
But I don't know who I am anymore
I'm a little insecure

Insecure, insecure
Need a cure
I want to be what you
I want to be what you want
Insecure, insecure
Need a cure
I want to be what you
I want to be what you want
Insecure, insecure
Need a cure

Misplaced
Headspace
Late on my rent with a straight face
Nobody can get ahold of me 'til I get hold of myself

Sorry, cause I don't know who I am anymore
Sorry, my emotions got me chained to the floor, the floor
I want to be what you want
I want to be what you need
But I don't know who I am anymore
I'm a little insecure
Insecure, insecure
Need a cure
I want to be what you
I want to be what you want
Insecure, insecure
Need a cure
I want to be what you
I want to be what you want
Insecure, insecure
Need a cure",pop,Insecure,-0.8,-0.4,2019
698,699,Enik,"Excuse me I forgot your face
Was it love or just a passing through the dark
I'm a stranger in autumn
I was born in spring

I forgot the name of seasons in between
Someone said it's good for growing
Someone said it's good for going
Someone said it's good for growing

I love you that's why I can't see you fail
And I swear I won't stand here to the essence of your heart's fade away [??]
I'm a stranger in autumn
I was born in spring

I forgot the name of seasons in between
Someone said it's good for growing
Someone said it's good for going
Someone said it's good for growing

Someone said it's good for growing
Someone said it's good for going
Someone said it's good for growing
Someone said it's good for.....",pop,The Seasons in Between,-0.8,-0.5,2006
700,701,The Twilight Singers,"Southern trees bear strange fruit
Blood on the leaves and blood at the root
Black bodies swinging in the southern breeze
Strange fruit hanging from the poplar trees

Pastoral scene of the gallant south
The bulging eyes and the twisted mouth
Scent of magnolias, sweet and fresh
Then the sudden smell of burning flesh

Here is fruit for the crows to pluck
For the rain to gather, for the wind to suck
For the sun to rot, for the trees to drop
Here is a strange and bitter crop

Southern trees bear strange fruit
Blood on the leaves and blood at the root
Black bodies swinging in the southern breeze
Strange fruit indeed, strange fruit indeed",pop,Strange Fruit,-0.3,-0.7,2004
701,702,COUCOU CHLOE,"I'm peeling off my Gucci when I'm bored
I think of you, yeah, when I'm bored
I get too high when I'm bored
It's way too bright outside, wow, what the fuck

I'm peeling off my Gucci when I'm bored
I think of you, yeah, when I'm bored
I get too high when I'm bored
It's way too bright outside, wow, what the fuck

I'm peeling off my Gucci cuz I'm bored
Maybe thinking of you because I'm so bored
Super high right now, I'm super bored
It's still too bright outside, wow, what the fuck

If I fall? Not at all
If I fall? Not at all
If I fall? Not at all
Not at all, not at all

I'm peeling off my Gucci when I'm bored
I think of you, yeah, when I'm bored
I get too high when I'm bored
It's way too bright outside, wow, what the fuck
I'm peeling off my Gucci when I'm bored
I think of you, yеah, when I'm bored
I get too high whеn I'm bored
It's way too bright outside, wow, what the fuck

What the fuck
What the fuck
What the fuck
What the fuck
What the fuck
What the fuck

Peeling off my Gucci when I'm bored
I think of you, yeah, when I'm bored
I get too high when I'm bored
It's way too bright outside, wow, what the fuck

Peeling off my Gucci when I'm bored
I think of you, yeah, when I'm bored
I get too high when I'm bored
It's way too bright outside, wow

I'm peeling off my Gucci when I'm bored
I think of you, yeah, when I'm bored
I get too high when I'm bored
It's way too bright outside, wow
I'm peeling off my Gucci when I'm bored
I think of you, yeah, when I'm bored
I get too high when I'm bored
It's way too bright outside, wow

Peeling off my Gucci cuz I'm bored
Peeling off my Gucci
High when I'm bored, it's way too bright outside, wow
What the fuck",pop,ZERO FIVE STARS,-0.7,-0.8,2021
705,706,Centinex,"[Music: Wiklund]

And when the moon
Has turned to black
Darkened clouds beneath
The astral stars
As the winds fly through
With wings so dark
A deep storming sea
With griefull past

I touch the grief, feel the pain
Taste the sorrow, before the dawn

The seagull fly in circles
Over an open sea
A morning again has risen
With silver tears
At the shore of a dreadful baltic
I touch the stones as the water
Echoes your name
Here I stand all alone
Themendous pain freeze inside
The sun sets slowly
Cold and silent
One day we will be united as one

I cry until dawn
My mind disappears into the dark
In a void where candles burn
Sleep forever, dream those dreams",pop,Before The Dawn,-0.6,-0.7,1997
707,708,Angels & Agony,"I can show you all the colours of the world
Tell you storys of wonder and joy
I'll show you mountains for you to climb
And why people cry and make love

I could tell you how to live your ilfe
Protect you from pain and harm
I want you to decide who and what you are
Create your own world

Heaven and earth and in between
Are yours forever as you will see
Step outside and spread your light

And if you ever go astray
Have no fear and make your way
Live like it's now or never
You'll walk on stars forever

Heaven and earth and in between
Are yours forever as you will see
Step outside and spread your light
And if you ever go astray
Have no fear and make your way
Live like it's now or never
You'll walk on stars forever",pop,Walk On Stars,0.6,-0.3,2007
710,711,Robbie Seay Band,"Psalm 63: 1-3

O God, you are my God;
Earnestly I seek you;
My soul thirsts for you;
My flesh faints for you

As in a dry and weary land where there is no water
So I have looked upon you in the sanctuary
Beholding your power and glory
Because your steadfast love is better than life
My lips will praise you",pop,Psalm 63,0.8,0.0,2013
711,712,Dean Martin,"[Verse]
Everybody sings the blues sometimes
And everybody knows the tune
Yeah, everybody knows the way I'm feeling
Cause everybody's had the blues

[Chorus]
A lonely, song someone is gone, a story old as time
Love, hate, or want and wait until misery fills your mind
But everybody knows the way I'm feeling
Because everybody's had the blues

[Chorus]
A lonely, song someone is gone, a story old as time
Love, hate, or want and wait until misery fills your mind
But everybody knows the way I'm feeling
Because everybody's had the blues",pop,Everybodys Had the Blues,-0.8,-0.1,1983
714,715,Jandek,"Now on the planes
Life ain't the same
On the planes
You can't see
Far beyond me
On the planes
Planes ain't got nowhere to go
So close your eyes",pop,One the Planes,0.3,-0.6,1986
715,716,Matt Bianco,"So here it is children yet another chance
Special delivery for one final dance
Prick up your ears, put on your dancing shoes
You've waited long enough so no time to lose

By now you know that only true love never dies
Just like mine
Take to heart, Ronnie's Samba
Love it back, Ronnie's Samba

Well friends it's high time to remember his name
Walk on the Wild side would not be the same
Everything feels right, every note falls into place
You can't help it but smile hearing what Heaven sent

And now you know [what heaven sent, what Heaven sent]
That only true love never dies
Just like mine
Take to heart, Ronnie's Samba, Samba, Samba
Love it back, Ronnie's Samba, Samba
It's your lucky day, prepare to be amazed
You know that only true love never dies
Just like mine

Take to heart, Ronnie's Samba, Samba
Love it back, Ronnie's Samba, Samba, Samba

Favourite spot Ronnie's Samba
Velvet noise Heaven's mannah
Perfect sky Ronnie's Samba
Clear Horizon, ey Caramba

Second chance, Ronnie's Samba
Melting heart, oh hosanna
Stolen Kiss, hardest dream
Stormy bliss, happy stream

Ronnie's Samba
Ronnie's Samba
Ronnie's Samba
Ronnie's Samba",pop,Ronnies Samba,0.8,0.6,2004
717,718,Dark Dark Dark,"I need a good night
I need a loving night
I need one last night, once again
I need a long night;
I need a lingering night;
I need a night that
Never ends
I need a good time;
I need a loving time;
I need one last time, once again
I need a long time;
I need a lingering time;
I need a time that
Never ends
And if I knew then
What I know now
I would never have asked
Anything like that
'cause what I needed -
How I hate to admit to admit to myself -
But its true: there was nothing you could do
I need a good fight;
I need a loving fight;
I need one last fight, once again
I need a long fight;
I need a lingering fight;
I need a fight that
Never ends
And if I knew then
What I know now
I would never have asked
Anything like that
'cause what I needed -
How I hate to admit to admit to myself -
But its true:
There was nothing you could do
A life filled with mystery and mystical moments
The mere sound of a voice that makes me feel like home
The weathering of an unfortunate event
With you
Or the you
I thought
That you should be -
And it's true: there was nothing you could do
And if I knew then
What I know now
I would never have asked
Anything like that
'cause what I needed -
How I hate to admit to admit to myself -
But its true: there was nothing you could do",pop,What I Needed,-0.8,-0.1,2013
718,719,The Blank Minds,"I woke up this morning
And I sat down to eat
There was nothing in my fridge
Just some fuzzy socks on my feet
I went down to the store
But they had nothing left
So I bought some cereal
And on my way I went

Put it in my pocket
Like your picture in my locket
Girl, you're so sweet
Frosted Flakes got nothing on me

I put it in my pocket
Like your picture in my locket
Girl, you're so sweet
Frosted Flakes got nothing on me
Whoa-oh, whoa-oh

We were vibing on the floor
I heard her screaming more
Was she talking to me?
I look behind and what do I see?
Flip-flop my heart done stop
Drip-drop the milk don’t stop
Breaking the homeostatic qualities
That maintain the milk and cereal harmony
I put it in my pocket
Like your picture in my locket
Girl, you're so sweet
Frosted Flakes got nothing on me

I put it in my pocket
Like your picture in my locket
Girl, you're so sweet
Frosted Flakes got nothing on me

Rice Crispies, you got me feeling frisky
Coco Puffs, I never get enough
Apple Jacks, I got your back
Cheerios, I hope you never go
Froot Loops, like the hoops in Saturn
Time spins like Lucky Charms' patterns
Girl, you got me hooked like captain crunch
I’ll eat cereal for breakfast, dinner, and lunch

I put it in my pocket
Like your picture in my locket
Girl, you're so sweet
Frosted Flakes got nothing on me

I put it in my pocket
Like your picture in my locket
Girl, you're so sweet
Frosted Flakes got nothing on me",pop,Cereal Song Live,0.8,0.5,2018
722,723,Lowes,"[Verse 1]
I'll take you to that place
We were, where you left me standing
And we can have that talk we never had before

And you can tell, and you can tell me
Things you never thought to say
And when it's all been said, we'll go our separate ways

[Pre-Chorus]
Then you say, you meant too much
But I can wait forever
Please don't waste my time
Oh, it's now or never
Then you say, you meant too much
But I can wait forever
Don't hold it

[Chorus]
You keep me searching
You keep me searching
[Verse 2]
You say you liked the way I talk
Like you don't remember
As if we never stayed awake till dawn
Just talking life over

And I'm so scared, and I'm so scared
The words will never leave your mouth
But you can find a way to make it all fall out
To make it all fall out

[Chorus]
You keep me searching
You keep me searching
Pick it up for me, take all that you need
Leave me standing there
You keep me searching

[Bridge]
Then you say
Come on love, come on love
Don't leave me hanging on
Come on love, come on love
I'm not the only one
Come on love, come on love
Don't leave me hanging on, leave me hanging on
[Chorus]
You keep me searching
You keep me searching
Pick it up for me, take all that you need
Leave me standing there
You keep me searching",pop,Searching,-0.8,-0.1,2018
724,725,NvMe,"[Chorus 1]
This time...i won't fall for stupid lies
Anytime dont expect me to believe the wrong from right

Got me dumb dumb dumb, over these emotions of mine yeah
Yes I know the the outcome but I give in everytime

[Verse 1]
She left me to save me, just to repay me
Better or for worst im stuck up on that subject lately

Maybe I just cannot be with you so call me crazy insane imma do it all again expecting change

This time, imma live with much regret
Next time imma hold you even tighter you can bet

Like the sun you shine through all the darkness in my life
If you tell me that im wrong then I dont wanna be so right

Yeah you know that I can't live without you
I don't want this pain, I dont have to
What I'm meant to do I dont have a clue
Whatever it takes imma go until I find you
[Chorus 2]
This time...i won't fall for stupid lies
Anytime dont expect me to believe the wrong from right

I dont kno-o-o-o, bout these emotions of mine yeah
Yes I know the the outcome but I give in everytime

[Verse 2]

Yeah you screwing up my mind
Im on 2 different dimensions
I dont give a damn about the things these people mention
They don't know me neither do i at certain times

But

Got me feeling wasted I crave you bout all the time

Yeah she left me to save me she said its to repay metr
Better or for worst im stuck up on that subject lately

I dont do no drugs got me feeling kinda hazy
I been out my mind cause I be thinking of her daily

( Ambient )
Her daily

I been thinking of her daily

Oh oh oh oh oh

I been doubting please dont hate me

I can't let you go right now so please dont hate me


[Chorus 3]
This time...i won't fall for stupid lies
Anytime dont expect me to believe the wrong from right

Got me dumb dumb dumb over these emotions of mine yeah
Yes I know the the outcome but I give in everytime",pop,This Time,-0.6,0.4,2021
