,Unnamed: 0,artist,lyrics,tag,title,x_coordinate,y_coordinate,year
356,357,Xscape,"[Verse 1: Tamika Scott]
The snow is falling like I knew it would
Carolers are already singing
(La la la la la, la la la)
Last year is all that I can think about
Every time I hear sleigh bells ringing

[Pre-Chorus: Tamika Scott & Xscape]
But I, I know
That when summer came I pushed you away
I should have never let you go, no
Now all I'm really trying to say is

[Chorus: Xscape & Tamika Scott]
I want you to come home
I know that there won't be a Christmas without you
(I miss you so much)
You're all that I want (I want)
I know that there won't be a Christmas without you
I miss you, come home (I miss you)
[Verse 2: Kandi]
I remember all the love we made
I miss your stocking on the fireplace
Ooh, underneath the mistletoe we stayed
T'was a very special holiday

[Pre-Chorus: Tiny & Xscape]
But I, I know
That when summer came I pushed you away
I should have never let you go, no
Now all I'm really trying to say is

[Chorus: Xscape & Tiny]
I want you to come home
I know that there won't be a Christmas without you
(Oh, I) You're all that I want
I know that there won't be a Christmas without you
(Come on home, come on)
I miss you, come home

[Bridge: LaTocha Scott]
There's a fire that's still burning in my heart tonight
There's no reason why we both should be alone
It's the night before Christmas
And I'm waiting here for you to come home, come home
[Chorus: Xscape & LaTocha Scott]
I want you to come home
I know that there won't be a Christmas without you
(There'll never be another Christmas without you, baby)
You're all that I want
I know that there won't be a Christmas without you
(Without you here in my life)
I want you to come home
I know that there won't be a Christmas without you
(I know there'll never be, there'll never be another Christmas, no, oh no)
You're all that I want
I know that there won't be a Christmas without you
(No, baby)
I want you to come home
I know that there won't be a Christmas without you
(Never be, there'll never be another Christmas)
You're all that I want
I know that there won't be a Christmas without you",rb,Christmas Without You,-0.8,-0.2,1996
359,360,ORLI ANROW,"[Verse 1:]
I can hear it so clearly inside my head
You're the melody that makes me dance the night away
Don’t want anyone talking about heartbreaks and lament
Only loving life come slide with me in this opulence

[Chorus:]
Clap, step, stop, and baby we’re on top
I got something hot, darling don’t you love it now
Clap, step, stop, and baby it’s a wrap
This jukebox got us in euphoria

[Verse 2: Female Vocals]
Let me take a second before I jump in
My head’s been spinnin’ that’s what your love does to me
(Yeah, baby, what your love does)
Evеrybody talkin' 'bout wanting all these fame and monеy
But I just be wanting to blow your mind and your body
Now come ride with me till eternity

[Chorus: Female Vocals]
Clap, step, stop, and baby we’re on top (On top)
I got something hot, darling don’t you love it now (I love it)
Clap, step, stop, and baby it’s a wrap (Wrap up)
This jukebox got us in euphoria (Euphoria)
[Bridge:]
Swag, swaggin', swaggin'
No cap, all day, baby, it's a habit
All night long, we fucking like rabbits
Off the dome, that Brentwood hello felt like magic
Wake up, wake up, put this on, baby, yeah, turn it up
In the morning, I love the faces that you make when you squirt
No PG-13, baby, this shit is R-rated, that's how I thug it up
It's thugnificent, her pussy is magnificent
18 year old, so palatible, load it up shoot
Did you get the scoop?
Yeah, she hopped in my spaceship coupe and I took her to the moon (Moon)
Got her off multiple times, you know it, I'm all that
Premi set the stage and gave her a performance of a lifetime, the encore was the climax (Ha ha)
All this euphoria, brought me insomnia
But let's slow it down, there's no need to giddy up
You my L.S.D. Love Supply Dose
I think I already mentioned that, last time MVP, play it back, uh

[Chorus: ORLI & Female Vocals]
Clap, step, stop, and baby we’re on top (On top)
I got something hot, darling don’t you love it now (I love it)
Clap, step, stop, and baby it’s a wrap (Wrap it up)
This jukebox got us in euphoria (Euphoria)",rb,Euphoria,0.4,0.7,2021
361,362,Taveeta,"[Verse 1]
Why did we
Start like this?
Lead me on
With your kiss
Never felt
Sparks like this
But boy do you really know what love is?

[Verse 2]
‘Cause now we’re here fallin’ out
Actin’ like we’re nothing now
Do you even give a damn?
Don’t pretend this wasn’t real
Don’t pretend you didn’t feel
I don’t really understand

[Chorus]
‘Cause boy I don’t know why
Wake up, wake up
Come on and
Wake up, wake up
Why can’t you see me?
You know you need me
Wake up, wake up
Come on and
Wake up, wake up
‘Cause you’re running out of time (Time)
[Bridge]
Why did you
Hold me close (Hold me close)
When you knew
You’d let go
So much for
What we had
I didn’t think it would get this bad

[Verse 3]
Back and forth
Been here before
Actin’ like you love me more
Do you even care at all?
Tell me now, should I quit
Slippin’ through your fingertips
Now’s your chance to make the call

[Chorus]
‘Cause boy I don’t know why
Wake up, wake up
Come on and
Wake up, wake up
Why can’t you see me?
You know you need me
Wake up, wake up
Come on and
Wake up, wake up
‘Cause you’re running out of time (Time)
[Chorus]
‘Cause boy I don’t know why
Wake up, wake up
Come on and
Wake up, wake up
Why can’t you see me?
You know you need me
Wake up, wake up
Come on and
Wake up, wake up
‘Cause you’re running out of time (Time)

[Outro]
Wake up, wake up, wake up, wake up, wake up, wake up, wake up, wake up
Wake up, wake up, wake up, wake up, wake up, wake up, wake up, wake up
Wake up, wake up, wake up, wake up, wake up, wake up, wake up, wake up
Wake up, wake up, wake up, wake up, wake up, wake up, wake up, wake up
Wake up, wake up, wake up, wake up, wake up, wake up, wake up
(So goodbye) Wake up
Wake up, wake up, wake up, wake up, wake up, wake up, wake up
(Goodbye) Wake up
Wake up, wake up, wake up, wake up, wake up, wake up, wake up
(Yeah goodbye) Wake up
(Bye, bye) Wake up, wake up, wake up, wake up, wake up, wake up, wake up
Wake up",rb,Wake Up,-0.4,0.6,2017
363,364,Mali Music,"[Verse 1]
Heartache, heartbreak, pain
That's the only song we sing
That's the only thing life seems to bring, yeah
But tonight, we going to a place few speak of
Great Grandmamma and Granddaddy love, yeah
Illegal love yeah, and the divorce rate is outta control
Too many broken homes I know, it gets hard y'all
And that's why we gotta take it to God y'all
Love each other now
Oh your sister, your brother now
Butta, don't let go
You need a dose of that heavy love

[Chorus]
You can't move it, you can't shake it
You can't beat it, you can't take it
It's unchanging, heavy love
It ain't changing, heavy love
So much power, so much patience
It's a love, so amazing
It ain't moving, heavy love
It ain't breaking, heavy love
[Verse 2]
I wanna live in a world where
Mothers and daughters, fathers and sons
Are coming up together as one, yeah
In a place where two people who know that they knew one another
Not only fall in love yeah, but stay in love yeah
Hey now, at times when you're hurtin' the worst
That's when love feels the best, yeah
That's when it matters the most yeah
So find your lover, find your friend
Tell that one you love that you need him yeah
Give him a dose of that heavy love

[Chorus]
You can't move it, you can't shake it
You can't beat it, you can't take it
It's unchanging, heavy love
It ain't changing, heavy love
So much power, so much patience
It's a love, so amazing
It ain't moving, heavy love
It ain't breaking, heavy love

[Bridge]
Talkin' bout' that 20 year, 30 year, 40 year love
That's the power of the, heavy love
So much power, heavy love
I'm talking bout' that one, that only
Loving you my whole life
That's the love, heavy love
Heavy love, heavy love
[Chorus]
You can't move it, you can't shake it
You can't beat it, you can't take it
It's unchanging, heavy love
It ain't changing, heavy love
So much power, so much patience
It's a love, so amazing
It ain't moving, heavy love
It ain't breaking, heavy love
Ooohh",rb,Heavy Love,0.9,0.6,2014
364,365,Carti Bankx,"[Chorus]
Shawty wanna fuck with a nigga with some vision
My dawgs goin' up, lately we been on a mission
See them hating these days, we ain't tripping
I been moving at a steady distance

[Post-Chorus]
Family, gang, money, that order
I don't give a fuck 'bout things want me
Praying to the best, I love you
Me and all my niggas smoking Buddha
Sleep on the boy, y'all be snoozing
Pop another pilly, keep me moving
They been watching me just like a movie
Lately life is feeling like a movie
Four more out, I feel some type of way
Gassed up shawty, smoking all day
Making hits, girl I seen her so hardly
Only you that I want, baby stop the games
Yeah, woke up this morning thinking 'bout a check
I want run it up, I won't break a sweat
I been up for days thinkin' 'bout what's next
Counting dirty money 'til we filthy rich
Roll it up, sip it, we do whatever
I ain't dealing with like any pressure
Roll it up, sip it, we do whatever
I ain't dealing with like any pressure, nah
[Chorus]
Shawty wanna fuck with a nigga with some vision
My dawgs goin' up, lately we been on a mission
See them hating these days, we ain't tripping
I been moving at a steady distance
Shawty wanna fuck with a nigga with some vision
My dawgs goin' up, lately we been on a mission
See them hating these days, we ain't tripping
I been moving at a steady distance

[Post-Chorus]
Family, gang, money, that order
I don't give a fuck 'bout things want me
Praying to the best, I love you
Me and all my niggas smoking Buddha
Sleep on the boy, y'all be snoozing
Pop another pilly, keep me moving
They been watching me just like a movie
Lately life is feeling like a movie
Four more out, I feel some type of way
Gassed up shawty, smoking all day
Making hits, girl I seen her so hardly
Only you that I want, baby stop the games
Yeah, woke up this morning thinking 'bout a check
I want run it up, I won't break a sweat
I been up for days thinkin' 'bout what's next
Counting dirty money 'til we filthy rich
Roll it up, sip it, we do whatever
I ain't dealing with like any pressure
Roll it up, sip it, we do whatever
I ain't dealing with like any pressure, nah
[Outro]
Shawty wanna fuck with a nigga with some vision
My dawgs goin' up, lately we been on a mission",rb,Distance,0.6,0.8,2017
365,366,Van Morrison,"[Verse 1]
Open your arms in the early mornin'
When the light comes shinin' through

[Chorus]
Can't you hear my heart beat just for you?
Beating so wild, honey
(So wild)
And the light comes shinin' through

[Verse 2]
Singin' my song
And the band is playin'
And the music is tried, tried and true

[Chorus]
Can't you hear my heart beat just for you?
It's beating so wild, so wild, honey, yeah
And the light comes shinin' through

[Bridge]
I'll be waiting for you
I'll be waiting there for thee
(I'll be waitin' for you)
Way up on the mountainside
Where the hillside rolls
Rolls down to the sea
[Verse 3]
Tell me what's real?
(Won't you tell me)
What you feel inside
(What do you feel)
Any time of day or night will do
(Any time of day or night, you can call me anytime)

[Chorus]
Can't you hear my heart beat just for you?
(Can't you hear my heartbeat)
It's hurts so wild, honey
(So wild, so wild)
And your light comes shining through
(Shine, shine on, shine through, shine)

Play on, play on, play

[Bridge]
I'll be waiting for you
(Yes, I'll be waiting for you)
I'll be waiting there for thee
(I'll be waitin' there, as long as it takes)
Way up on the mountainside
(Way up on the mountainside)
Where the hillside rolls
(Where the hillside rolls)
Rolls down to the sea
(Rolls down to the sea)
[Verse 4]
Tell me what's real
(Tell me)
What I feel inside
(Anytime)
Any time of day or night will do
(Anytime of day or night, baby)

[Chorus]
Can't you hear my heart beat just for you?
(Just for you, yeah)
And it's so wild, honey, so wild
(So wild, so wild, honey)

[Outro]
Your light, and the light
And the light, and the light
And the light, and the light
And the light, and the light
And the light, and the light
And the light, and the light
And the light, and the light
And the light, and the light
And the light, and the light comes shining through
The light, the light, the light, the light
The light, the light, the light, the light
The light, the light, the light, the light
The light, the light, the light, the light
The light, the light, comes shining through
Feel it, feel it, feel it
Feel it, feel it, feel it
And the light that comes shining through
Let it shine on, shine bright, and true",rb,Wild Honey,0.9,0.6,1980
367,368,OMEHGA,"VERSE 1: (OMEHGA)

I…
Heard every word that you said, but I swear I
Feel like…
It ain't right
When the pride getting swallowed up
But its on one side
Why i gotta lie, huh?
Not the only one...
Wit they heart in
Leave drama in the streets
Where it started
All we do is fight
Tried to keep tight
Now i’m on a flight
And i see u
Blocking my calls
And when i call back
I get the voicemail
But
Never call back
Bump into your girlfriends
Man, they some cold cats
You say fed up
I say we both that
When i was
Back home
All you did was talk - back
Never had a convo
More like backlash
I would say one word
Set the whole thing off
You get turnt up
I get turnt off
Come on
BRIDGE: (Maureen)

I gave you me…...
All my heart…
And my time boy
Can’t believe you would feel
Like it ain't enough
I held you up
I held you down
But for me
It just seems
Like you ain't around

CHORUS: (Maureen)

No more
Of this he said
And she said
I can’t
Take
No
No more
Of this he said
And she said
I can’t
Take
No more
VERSE 2: (OMEHGA)

I think you got that
The selective hearing…
And the memory
Don’t make sense to me
Lovers to enemies
It’s like two of y’all here
A gemini, huh?
Reached an impasse
And that’s so sad
Was i so bad?
Well don’t hold back
It’s dirty water
Under the bridge
I got my own ways
And imma own that
But you talk like
My soul black
And its spread thin
Wit evil intent
If that's true and all
Then why you here?
Say no more
All you want
Wanna call shots
Take the safety off
When the smoke clears
You can see my path
Never look back
My past is that
What?
BRIDGE: (Maureen)

I gave you me…...
All my heart…
And my time boy
Can’t believe you would feel
Like it ain't enough
I held you up
I held you down
But for me
It just seems
Like you ain't around

CHORUS: (Maureen)

No more
Of this he said
And she said
I can’t
Take
No more
No more
Of this he said
And she said
I can’t
Take
No more

No more, no more
I can't take no
No more, no more
I can't take no

No more
Of this he said and she said
I can’t
Take
No
No more
Of this he said and she said
I can’t
Take
No more",rb,No More Remix,-0.8,-0.4,2017
368,369,CammWess & John Legend,"[Verse 1: CammWess]
She packed my bags last night, pre-flight
Zero hour: 9:00 a.m
And I'm gonna be high as a kite by then, oh

[Verse 2: John Legend]
Whoa
I miss the Earth so much, I miss my wife, yeah
It's lonely out in space
On such a timeless flight, oh yeah

[Chorus: Cammwess & John Legend, Both]
And I think it's gonna be a long, long time
'Til touchdown brings me 'round again to find
I'm not the man they think I am at home
Oh no, no, no, no
I'm a rocket man
Rocket man
Burning out his fuse up here alone

[Verse 2: Cammwess & John Legend, Both]
And all the science
I don't understand
It's just my job five days a week
A rocket man
Whoa, a rocket man
A rocket man
Hey, hey, hey
[Chorus: Cammwess & John Legend, Both]
And I think it's gonna be a long, long time
'Til touchdown brings me 'round again to find
I'm not the man they think I am at home
Oh no, no, no
I'm a rocket man
Hey, rocket man
Burning out his fuse up here alone, oh (Oh)
And I think it's gonna be a long, long time
I think, I think, I think
(Hey) I think it's gonna be a long, long time
(Oh, it's gonna be, yeah, yeah)
And I think it's gonna be a long, long time
Whoa, oh

[Outro: Cammwess & John Legend]
And I think it's gonna be a long, long time
Yeah",rb,Rocket Man,-0.7,-0.7,2020
369,370,GAIKA,"[Verse 1]
God save the roadmen, goons and thugs
All the yutes beggin' boots
Get their racks from drugs
Oh, and angels holdin' stocks for your blud
'Cause London City isn't built on God
No, no, no, we must stand up
Choppers with the coppers
Man, we show no love
No, no, no, oh no, can't kill us
Na na na, na na na, na na na

[Hook]
When I pass through
Salute fi the king
Raise an arsenal
'Cause we strip everything
Every crown and key
Every bloodclaat ting
Every crown and key
Every bloodclaat ting
[Hook]
When I pass through
Salute fi the king
Raise an arsenal
'Cause we strip everything
Every crown and key
Every bloodclaat ting
Every crown and key
Every bloodclaat ting

[Verse 2]
It's coke money, joke money, black's another trap
All these motherfuckers just smite all of man
Oh, you talk so, oh, you talk too much
There's more to your vision, made a prison of them niggas
Understand, man, I'm swingin' with the killers
Fuck honour, guilt and magazine fillers
Guerilla warfare, you can ask Mr. Skinner
Been Southside, swimmin' with the drillers
Since iceberg I'm paddlin' the pillers
I'm in this for the immigrants, I'm rilin' up the villas
I'm in this for the shotters putting bleach in your liver

[Chorus]
Kill 'em all, bodies in the street
Your mother's tears in the hot concrete
Madame Guillotine, Madame Guillotine
Kill 'em all, bodies in the street
Your mother's tears in the hot concrete
Madame Guillotine, Madame Guillotine
Kill 'em all, bodies in the street
Your mother's tears in the hot concrete
Madame Guillotine, Madame Guillotine
[Verse 3]
[?] with that cigarillo [?]
Fickle politics, bitch, I'm in it for the dough
Greed put her thirst on the wannabes
Hide in murky parts, when you're gone [?]
No, no, no, not my level, not my lane, not close
No, no, no, throwin' shade at the shadows in the gold
I'm a South Londoner, don't you know
Laughin' like a fool when the bodies hit the floor

[Chorus]
Kill 'em all, bodies in the street
Your mother's tears in the hot concrete
Madame Guillotine, Madame Guillotine
Kill 'em all, bodies in the street
Your mother's tears in the hot concrete
Madame Guillotine, Madame Guillotine
Kill 'em all, bodies in the street
Your mother's tears in the hot concrete
Madame Guillotine, Madame Guillotine

[Outro]
So, we shout it to the ground
They be fuckin' up the place for the dollars and pounds
And ill gotten gains, we suffer and drown
But revel up if you're down
'Cause we're in the streets where no banners dem found
Every ghetto yute must take back him crown
Just ride if you're down, this fight is right now",rb,Crown  Key,-0.6,0.6,2018
370,371,Patti LaBelle,"Sorry to disturb you
But I had to get this off my chest
I know you've been real busy
Don't have time for emotional stress

You see, taking care of home
Means more than just the rent
It means calling now and then
On occasion, stopping in
And sometimes having flowers sent

What if I stayed out late
And didn't even call
Wasn't there to pick you up
Whenever you fall
If I didn't smile and compliment you when I should
Tell me what would you do
If the shoe was on the other foot
Tell me what would you do

Oh, I think you take for granted
That I'm always gonna be here
This is your final notice
Soon I'm gonna disappear
I'm not asking for a whole lot
Just think of me now and then
If you don't know what I'm saying
I don't know how this love can win
And didn?t even call
Wasn't there to pick you up
Whenever you fall
What if I stayed out late
And didn't even call
Wasn't there to pick you up
Whenever you fall
If I didn't smile and compliment you when I should
Tell me what would you do
If the shoe was on the other foot

Well, you should do unto others
As you would have them do to you
You reap what you sow
And that's how it goes
So be careful what you do
Tellin' you ain't no good gonna come to you

What if I stayed out late
And didn't even call
Wasn't there to pick you up
Whenever you fall
If I didn't smile and compliment you when I should
Tell me what would you do
If the shoe was on the other foot

What if I stayed out late
And didn't even call, that would be a no-no baby
Wasn't there to pick you up
Whenever you fall
If I didn't smile and compliment you when I should
Tell me, tell me what, what would you do
If the shoe was on the other foot
Tell me, tell me what would you do
If you had to, tell me
If you had to do like I do sometimes...",rb,Shoe Was On The Other Foot,-0.6,0.5,1997
372,373,Cayluu,"[Chorus: Cayluu]
She like designer on her bag, that’s Prada
She smooth just like gelato
Post that photo on the gram, that’s fire
Like she could be a model
She fine
When she pull up I say that she’s mine
If you broke then she don’t got the time
She smooth like that
She smooth like that
She smooth like gelato

[Verse 1: Devin]
I’ma pull up on you riding in that Wraith truck
Face it, theres nothing ‘bout me that you hate (Oh nah, nah, nah)
Complacent, they just tryna take your place but
When I makе it you gon’ be the one I takе with me (Ooh)
‘Cause the way I be loving you call it faithfully (faithfully)
You in all my dreams but this ain’t make believe (make believe)
When I say I’m on the way don’t gotta wait for me (gotta wait for me)
To your crib I’m going 80, your love is what I’m craving
Let’s go take a trip all on the west coast (west coast)
Lay low when we alone it feels the best tho (the best)
But best know that you different from the rest tho
Successful we be cashing out them checks (woah woah woah)
Take you places you ain’t ever been before
Only us nobody else is gonna know
The way you make me feel so unconditional
Hop into my whip lets take a trip girl let’s go
They only wanna see us when we six feet below
Me and Cayluu on the track and you know we about to blow
So tell me if you’re with it cause I’m really tryna know
If you smooth like gelato
[Chorus: Cayluu]
She like designer on her bag, that’s Prada
She smooth just like gelato
Post that photo on the gram, that’s fire
Like she could be a model
She fine
When she pull up I say that she’s mine
If you broke then she don’t got the time
She smooth like that
She smooth like that
She smooth like gelato

[Verse 2: Cayluu]
I’ma get you that designer how you like it
Fly you out up in the jet you know its private, yeah
You the main course i don’t need a side chick (side chick)
Never loved before why don’t we try it, ouu
They don’t know you the way the way that I do
They be so obsessed with you
Why don’t we chill up in the stu
I got all these songs that I wrote about you
I wrote about you
I got lucid dreams and I put that on Juice (yeah yeah)
Tell me what you wanna do
Together we will never lose
[Chorus: Cayluu]
She like designer on her bag, that’s Prada
She smooth just like gelato
Post that photo on the gram, that’s fire
Like she could be a model
She fine
When she pull up I say that she’s mine
If you broke then she don’t got the time
She smooth like that
She smooth like that
She smooth like gelato",rb,GELATO feat. Devin,0.9,0.6,2021
373,374,B Mac & B Sev,"(Signed off with the Colin Brackett)
(Kenneil)
Ouu yeah, oh yeah
(B Mac)

It's crazy how you wanted me, love
Your figure lookin’ heaven above
Chillin' with you bae what's up
Say yup
I’m chillin' with you
Baby its new
Baby you got me
I know that you knew
Was loving the mood
Knowing I wanna get with you, yeah
Never misconstrued, yeah

You know that you love (It)
Just can't get enough
Maybe it's just lust
You know what you want
I just want one touch
Those kisses and hugs
I know what you want
Just got that good love, yeah
Kiss and touch, yeah
We can go undercover, yeah
And make some love, yeah
(We're chillin' we're chillin' yeah)
Your presence is such a blessing
I’m never second guessing
To tell whether you’re the right one for me, yeah
She a lil freak, yeah
Baby i know that you love it when i treat it
Got your heart beating
All i want is you
Baby don't wait in queue
I just wanna tell

You know that you love (It)
Just can’t get enough
Maybe it's just lust
You know what you want
I just want one touch
Those kisses and hugs
I know what you want
Just got that good love, yeah
Kiss and touch, yeah
We can go undercover, yeah
And make some love, yeah

I just wanna tell
You're the best thing I've felt
Better than anybody in this world and yeah that’s a fact
And you know that I got you
You got my back
Sweetest girl
From a different world
She ain't from earth
Don't know your worth
I'm not lyin'
Cause I just want some
Yeah I just need some (Yeah)
You know that you love (It)
Just can't get enough
Maybe it's just lust
You know what you want
I just want one touch
Those kisses and hugs
I know what you want
Just got that good love, yeah
Kiss and touch, yeah
We can go undercover, yeah
And make some love, yeah",rb,Undercover Love,0.3,0.6,2019
