,Unnamed: 0,artist,lyrics,tag,title,x_coordinate,y_coordinate,year
154,154,Bounty Killer,"[Intro]
Well, this one reaching out to all the leaders and the media
Well, this is Rodney Price aka Bounty Killer
The leader for Poor People Government

Well, poor people fed up to how yuh system sheg up
Yuh issue gun fi wi pickney bus
Poor people fed up to how yuh system sheg up
Well, everyday the ghetto youths dead up

Mi ask the leader, him a di arranger
Fi mek poor people surround by danger
Fly an the roach an giant mosquita
Sewage water whey fill wid bacteria

Unno ever tek a look dung inna di Riverton area
Bactu, and Seaview, Waterhouse, Kentire
Long time the MP him nuh come near yah
And the nedda one whey claims sey she a counselor

Rob senventy five percent and gi wi quarter
Conquer the land nuh waan fi gi wi a acre
Disconnect mi light an chop off mi water
To the Kings of Kings, well mi know them shall answer
The Lords of Lords well a him a wi sponsor
The lion from Judah dem well waan conquer
The eagle an the bear and the Queen an all daughter

Haile Selassie I mi know the whole a dem after
But them a go guh dung inna flames and water
See Selassie I nuh tek fi fun or laughter

Well, poor people fed up to how yuh system sheg up
Yuh issue gun fi wi pickney bus
Poor people fed up to how yuh system sheg up
Well, everyday the ghetto youths dead up

Some lost dem roots and figot dem culture
Nuh study the past, dem nuh know the future
Some nuh tek telling, so dem end up so vulgar
Dem don't know Selassie I from Ethiopia

Serious as mi born, nuh tek mi for any joker
Dat same man mek mi hol dem note yah
Mi nuh play dem casino, mi nuh play dem poker
Dem plan fi destroy wi wid the coke an drugs yah

Nuff gravalicious like a damn barracuda
Plan to lick Ronnie Thwaites off a di piece a scooter
Yuh think dem like to see wi inna dem hot car ya
Wid dem hot gal yah a sing dem song ya
Dem song yah stronger than them vial and obeah
Mi a go heng Pope Paul wid da piece a rope ya
Jus because

Well, poor people fed up to how yuh system sheg up
Yuh issue gun fi wi pickney bus
Poor people fed up to how yuh system sheg up
Well, everyday the ghetto youths dead up",rap,Fed Up,-0.6,0.5,1996
155,155,666laughter,"Bby don’t go hol up
I’m boutta roll roll up
We can smoke those prolems
Unleash ya whole aura
I want ya soul oh ya tryna ge closa toya
Wan u ta pull me ova
Wan ya be ya lotus know this

I can’t
Get you
Off myyy
I can’t get you off my mind
Can’t can’t get you off of mine
Can’t not get you out my mind (chorus)

Tell me what ya deal
Tell me how I make you feel
Tell me slaughta ya hona I wan 2 b ya mighty real
I’m smoking not joking  savage make u squeal
Misdirect the important manifest my speel
I can’t be unimported multi national exotic
I confess through melo low odics
I get stressed bout mariju-wan it
Caring more no won’t endorse it
All we care bout is da profit
Gotta b a millionairе until then I am starving
Talking niggas bout the principal
Sincerе savage cynical
Read em, a book and now they tryna get physical
Can’t stand waisting time that’s why I sit and spit on dimes
If I look hit I hit the blunt I’m always sickening savage cunt
I’m sicka runtz I need to hunch
U wan sun food I’ll feed u lunch
Feel free to touch give me ur lust
Yk I want to be ur must
The one & only no oppone
Energy it make u horny
Devil go n dance upon em
Lil nas x yk I want him
(Chorus 2x)

Pls say less get to the gist
What is the moral of d story
Living to have glory whorey
In my cup I’m pouring pouring
Making money no forex
Gotta chemical imbalance ykwtf it means it means I got low storage
Slaughter slaughter slaughter
Imma call u by my name
Call me Montéro x papi when I put it on ya face
I’m the devil get it sloppy know u wonder how I taste
Maneater witch doctor ur injections otw
CMBYN
Tell me that u love my skin
Green tabs + gin
Love when we sin
Flip u fold u lust won’t hold u
Fuck me feed me need me closer
Call me by ur name won’t hold up
Don’t get all the pictures tore up
I pick Peter by his piper cause it go up when I show up
Yuh don’t make me fuck yo life up im the drug u craving for it

Said I smell like ggg
Oui oui oui
Parlevoo francee
Don’t rock no givenchy
I like Gucci yves saint laurii
Say u luv me",rap,Nightim6,0.4,0.7,2021
156,156,Melvin boy x Pablo,"[Verse1: Melvin boy]

I seem to seek the velvet of ur lips
Late night when we on suckin' those spur rips
Imagine I pompously put my hands on ur hips
Makin' love like it's apocalypes, noh
Shorty you surely the one  for me
Your love i got, your blips i lick
We're happy they hate
Aii suka man! Yekela ba ku cabanga a masimba ngathi ba zo hlala ba ringa man!
Akukho umuntu ofana
Nawe you so versatile
Girl o ne nye in'to i'ya ngi hlokologa
A ngeke u fihle loyo mzimba phakathi kwa'm 'Jams
A gaze ngi zizwe kanje 'bout no - lady
You drive me so - crazy
Nomabangathin nga thi
Ngi zo beka i'ring duze no muno wakho

[hook-pablo]
Something u forget
I mean't to say something in ur way
I want to be someone that u will live with forever
I want something with u, with u and i'll always be there forever!

[Hook]

[Verse2: Pablo]
I wonder why you plead guilty, You know you stole my heart, when i ask about the ventricle you say you got my blood
Im like wow!! ,what a criminal ,no police involved i just wanna fall inlove
I know you feeling the feeling that i've been trying to feel then you suddenly call the cops cause i had the same feeling
When i look at your eyes been trying to coup all my lies
Go bohloko nyana cause i had to act little nice
But 'whoa' mommie ema i think it's time for magadi, turn a lil angel like you, ke go etse legwabe
Matter of Fact, the ring is on your finger ring the bell let them fight, we need a pastor real quick so i can kiss the bride
And your ex is jealous babe let me solve for x, you have a studio heart that's why i hear your beat
Babe it's not easy saying goodbye
But the truth true love will never ever die

[Hook x2]

[Bridge: Melvin boy & Pablo]

I didn't mean to take your heart(your heart)
I didn't mean to steal your mind(ohh baby, ohh baby) (Ooohh)
Mxa babe lets go home(home) babe let's go home(ohoo)
We are (We are)
But i will always be there forever",rap,Forever,0.3,0.7,2015
158,158,Vandalyzm,"We get it in
We keep pushin'
We keep pushin'
We keep pushin'
We keep pushin'
We keep pushin'
We keep pushin'
And then and then we push out

Yeah. It's your boy Vandalyzm y'all. 14KT on the beat. Listen

[Verse One]:
Get your focus up
And if you need help then I'll coach ya brah
I'm so in tune with the culture brah
My kick game kinda sick mayne I'm off the ?
Like a dog or some tree bark
To rock Valentine's like mine you need heart
In the spring time I keep some divine sneakers
The fresh true ? with the pastel ?
Break the scene with the JBs, the game's ethered
Madonna ? man somebody please stop me
That boy there hella cocky
Green with the pink I think, y'all copy
Get it?
? when I use my mind y'all progress
Touch the Jedi's and get snuffed, Elliot Ness
The native one's a plague just bein' blunt
Forces I rock got ? on the front
Vandals and dunks
I.D's create a rig
The D brown pumps
You know the black and white ?",rap,Sole,0.7,0.2,2010
160,161,No Genre,"I'd like to welcome y'all to Jacque Beatz mass choir
And we step, and we rap, and we sell dope
Y'all ready
Ah yeah, hang on that mistletoe
I got to get to know you better
This Christmas
I see them nipple rings
You gotta let me see them things
This year baby, this year baby (when)
This Christmas
Showed you fire and ice, we gon' do this thing right
We gon' be, bumping and grinding through the night yeah
And this Christmas will be giving you very special dick for, dick for, your fantasy fantasy (fantasy, fantasy, fantasy)
And it don't matter what she say I pay for her pussy anyway
And it don't matter what she say I pay for her pussy anyway",rap,This Christmas,0.4,0.7,2016
164,165,Charles Hamilton,"[Intro]
Oh boy, turn it up some

[Verse 1]
So I'm back with a beat that makes no sense
I got no sense, but the flow's sick
If you know this broken shit
Then you know you've been attacked by the no sense twins
Me and the beat, still ain't got no sense
Oh shit, read it and weep
Imma bounce in the bounce, more bounce to the ounce
Bring em out cause they down for the count and I'm out
Got an issue with women, which one should I choose first?
The two flirts or the one with the blue purse
Two words: Sonic Orgy
No blue balls, you got it shawty
And I'm coasting, got em open
I'm an no kin, Bobby's throat is what I'm hoping for, oh shit
So much for me rapping with no sense

[Hook]
Just bounce to the biggy biggy bounce
The biggy biggy bounce
The biggy biggy bounce
Step out, show me what you all about
Pull your g- string down south, ow

[Verse 2]
And you're rocking with Hugh Hefner the Hedgehog
Got you girl working out her mouth, making her hedge hog
No beat, I ain't gotta make her head nod
To make her head nod, face full of eggnog
My bad, I'm bad like not good
I'm circumcised, I am not hood
But I got hood, starlight zone
Life's a bitch, I poke her and y'all might fall
I'm the motherfucking sun and y'all nice so...
Bye bye bitches, y'all in my zone
Cause I gotta zone on my own
If you wanna talk, you can all my phone
I don't wanna talk, I wanna run
Straight the tele, cause I wanna cum
All over these drums like....

It's Charles Hamilton

[Hook/Outro]
Just listen to me
Welcome to the LAMALAMP ZONE(x16)
Charles Hamilton, uptown
Just dancing, I see you Nate
Ah! This shit is stupid, whoo!

LAVALAMP ZONE(x8)
Welcome to the LAMALAMP ZONE(x8)

Just bounce to the biggy biggy bounce
The biggy biggy bounce
The biggy biggy bounce

Step out, show me what you all about
Pull your g- string down south, ow(x4)",rap,Sega Police,0.4,0.7,2013
165,166,DirtBoys,"(Chorus)
I can take you to a dark place
200 on the dash baby i can make your heart race
Help you through them dark days hard days
Fuck you in benz make ya heart race
I can take you to a dark place
200 on the dash baby i can make your heart race
Help you through them dark days hard days
Fuck you in benz make ya heart break

(ExaTheExacist)
Took some pills  feel like drivin today
Push the peddle to the max close my eyes n I pray
I Know you got a lot of guys in the frame
N baby all  i got to offer is a life full of pain
We gettin high lets take a drive in the rain
You feed my ego while we drive in the range.....
So open up why u hidin away
We takin all these fuckin drugs i feelin like dying today

(432TheDivine)
Baby lets ride
I know im drunk and i probaly shouldn't drive
But girl you got that look in your eye
Fuck the world let it burn
We like bonnie and clyde
Baby they will never take us alive
Im on a wave
Blue lights are flashing why we speeding away
Take this pill it always helps with the pain
Girl take my hand grip it tight better pray
Girl you better Buckle up i feel like dying today ayy
(Chorus)
I can take you to a dark place
200 on the dash baby i can make your heart race
Help you through them dark days hard days
Fuck you in benz make ya heart race
I can take you to a dark place
200 on the dash baby i can make your heart race
Help you through them dark days hard days
Fuck you in benz make ya heart break",rap,Feel Like Dyin,-0.8,-0.1,2018
166,167,T-Time,"[OPENING]
“Dad! Dad! Can you tell us a bed time monogatari?”
“Huh? uh yeah goddam aight.. sure… you lil... you lil shonens tucked in?”
“Yeahhh!!”
“Alright… here we go…”

[INTRO]
Once upon a time not long ago
There was man named T-TIME and he was bold
He gifted the world with an Animay mixtape
Now back again to show, VOL 1 was no mistake
He hath awaken from his slumber
Gathered up all #THAGODSQUAD members
TO PRESENT TO YOU FANS. THAT
ALL DAY ANIMAY. VOL-

[VERSE 1]
Two year time skip, back with it
T-TIME leveled up knock S.O.Ls outta orbit
The HOKUTO SHINKEN? I mastered it
Rap district BANCHO, put my back to it
Eight gates open, drop tracks like ROCK LEE
Snap my fingers, transmute that hot hi
Swag immortal, got ARAKI Gucci
Seven hot witches, all around me
GODSQUAD three hunna, sanbyaku
Servin ace shots, call that a HAKIYUU
You ROSSIU, No one likes you
I got TSUNDERES goin', “Baka… I love you!""
Half satan, blue flame, Based God (WOO)
Arrive in the SAIYAN, space pod
Me x ANIMAY, no NISEKOI
MAGIS tellin me, I’m the King boy!!
Back from the dead, BEYOND THE GRAVE
ALL DAY ANIMAY VOL 2, NEW WAVE
One punch, S-Class Hero
Holes in ya body, RIKI KEN-OH
Slay seventy men, MUSASHI
Shotty loaded, blast fifty S.A.T
Wavy FREE! fuckin SAILOR AMI
Got ya girl calling me, T-TIME Senpapi
On the mic, louder than D.M.C
After me? no man’s land, DMZ
Swerve left and right, PEAK SPIDER
No spill in my cup, drifting on haters
[HOOK]
YOU WATCHIN DUBS? SHIIT IM READIN SUBS
ALL DAY ANIMAY LIVING, CRUCIAL LIKE BREATHING, ON THIS TRACK STRAIGHT DAM KILLIN
YOU GETTIN PAPER? BOY IM STACKING MANGAS
IM OUT HERE GETTIN ALL THESE MINTS & COLLECTING LIMITED GODSQUAD FIGURINES
YOU FUCKIN 3D? GODDAM IM LOVIN 2D
REP THAT ANIMAY GANG LIFE,  NEVER FUCK WIT NO IRL LADY

[VERSE 2]
Utilizing 3D, I maneuver
Choppin' titan necks, in a JAEGER
Got TEIGUS, T-TIME GA KIRU
Perform on Letterman, like HATSUNE MIKU
TGS TAIL, we the best guild
RYOZANPAKU, only the best skilled
All black fit, DOROHEDORO
Too sharp, MR.1, KILLA BEE, ZORO
Serving lyrical ONIGIRIS, no rice dish
“Make Animay Real” My one KYUBEY wish
God level skrength, call me BLACK STAR
Gold experience on my neck n wrist, GANGSTAR
S/0 type TWILIGHT, no vampire
SILVER SPOON in my mouth, getting cheddar
KING OF STREET FIGHTER, THUG HUNTER
Destroy all, grippin' the BISCUIT HAMMER
JKD to ya face, SPIKE SPEIGAL
Break your arm into 2, Steven Segal
Rap game regal, had a neat prequel
ALL DAY ANIMAY VOL 2? A good sequel
[HOOK]

[VERSE 3]
Enter the NEW WORLD, smooth sail that
DARK CONTINENTS? Sunday stroll that
GOD HAND ECLIPSE? I survive that
Dining at GOURMET WORLD, getting fat
NO ANIMAY, NO LIFE... motto
Started from HAYATE, now we SUOH
Write rhymes on the BILLY BAT scroll
ALL DAY ANIMAY, number 1 on CRUNCHY ROLL

[HOOK]",rap,KODO BOOGIE,0.8,0.7,2015
168,169,Trippie Redd,"[Chorus: Trippie Redd]
Hold up, yeah, yeah, yeah
Yeah, I can teach that bitch my language like Rosetta Stone, yeah
Fuck that bitch one time and then I'm phoning home, yeah
Talk down, you get shot to your dome, yeah
Yeah, yeah
Yeah, yeah
I had to slime some niggas out, I damn near wiped they nose, yeah
Pussy nigga know I came from toting poles
And you ain't built like that, lil' nigga, you can get exposed, yeah
Yeah, yeah (Yeah)
Yeah, yeah

[Verse 1: Trippie Redd]
Fuck nigga, what you want? Huh (What you want?)
Know we keep them choppers like a movie role (Movie role)
I just need to know, is it truly smoke? (Truly smoke)
Yeah, 'cause you know we want the smoke, we truly want (Truly want)
To bust shots at the opposition
Pussy nigga, you ain't really in the right position
To be talking that gangster shit, pussy, you get hit coming
She like bah, bah, bah, get shot in your head, man
Yeah, get shot where the headband 'posed to be at
Pussy nigga, huh, yeah, uh, uh
Pussy nigga, huh, yeah
You can get hit up
[Chorus: Trippie Redd]
Hold up, yeah, yeah, yeah
Yeah, I can teach that bitch my language like Rosetta Stone, yeah
Fuck that bitch one time and then I'm phoning home, yeah
Talk down, you get shot to your dome, yeah
Yeah, yeah
Yeah, yeah
I had to slime some niggas out, I damn near wiped they nose, yeah
Pussy nigga know I came from toting poles
And you ain't built like that, lil' nigga, you can get exposed, yeah
Yeah, yeah (Yeah)
Yeah, yeah

[Verse 2: Coi Leray]
Yeah, uno, dos, tres, yeah, come and give me head
This a Glock .40, yeah, leave a nigga dead
Niggas be lackin', yeah, catch that nigga in traffic, shot him in the back
Might take your bitch, yeah, she wanna hang with the gang but this ain't that
Boy be telling, yeah, can't fuck with these opp ass niggas, they all rats
Hopped in my bag, Birkin, got out all this cash earned it
Tell me what you need, serve it, man, I make these bitches nervous
Yeah, yeah, ayy, ooh
Mmh, mmh, mmh, ayy
It's a Glock .40

[Chorus: Trippie Redd]
Hold up, yeah, yeah, yeah
Yeah, I can teach that bitch my language like Rosetta Stone, yeah
Fuck that bitch one time and then I'm phoning home, yeah
Talk down, you get shot to your dome, yeah
Yeah, yeah
Yeah, yeah
I had to slime some niggas out, I damn near wiped they nose, yeah
Pussy nigga know I came from toting poles
And you ain't built like that, lil' nigga, you can get exposed, yeah
Yeah, yeah (Yeah)
Yeah, yeah (Yeah, yeah)",rap,Everything BoZ,0.6,0.6,2019
172,173,Abhi,"*Unintellgible Sample*
Kicking buckets in my hometown
Kick the rocks of feet of fucking cities that i’ve flown out
Me and homies wilin guess thats how we gon’ be shown out
Words are floating round my mind
And with a pen they flowing out
Going down
Going for that pro sound
Passionate i’m grown now
Homebound for some [cold town?]
How y’all gon bite at the hand that fed y’all
Clowns appreciate the work before eventually i’ll have the crown
Rhyming shit
Yeah bitch I got time for this
Deconstruct my mind but if you tumble
You will find it is an endless pit
Anguished thoughts
Bitch might catch a crime and shit
Attention from someone is worth the time
Confined inside the brick
Nah
It isn’t for the fame
Just a catalogue of my thoughts
And when I can't deal with the pain
Thats just some new clothes that I bought
Yeah cuz most these rappers lame
Ain’t no message that they brought
All these mindless zombie brain
Collecting unreapable crop",rap,Buckets,-0.6,0.6,2018
173,174,Niq,"(Hook)

Slimey like slither (slatt)

Watch em all wither

Yeah

Thought that we better together (together)

I've been thinking (thinking)

I've been taking

I've been losing sleep on it I ain't even sleeping (sleep)

I ain't counting sheep (count)

I'm to many thou's deep

I might have to push up hit a fucker with a bald eagle (push up)
Poison me candy my cup when it gets jolly (jolly)

Shorty wanna fuck, and suck me like a lolly (suck me)

Shorty got plastic on her like a dolly (plastic)

It don't matter cause I know I'm good regardless


(Verse)

I wasn't tryna jump in it I was swallowed

Shooter right by me fill it up with hollows

Tryna slide through and get they ordеr like Mc Donald's

How they know I had the gold tickеt like Willy Wonka

I can't even leave it lone I hear it calling

If I hit him imma knock him out his knocker

Woah

Imma knock him off his rocker
I might send him up to mars with this rocket

They might have to ring alarms its a crisis

I advise it

It'll be provided

And its next to me precisely


(Hook)

Slimey like slither (slatt)

Watch em all wither

Yeah

Thought that we better together (together)

I've been thinking (thinking)

I've been taking

I've been losing sleep on it I ain't even sleeping (sleep)
I ain't counting sheep (count)

I'm to many thou's deep

I might have to push up hit a fucker with a bald eagle (push up)

Poison me candy my cup when it gets jolly (jolly)

Shorty wanna fuck, and suck me like a lolly (suck me)

Shorty got plastic on her like a dolly (plastic)

It don't matter cause I know I'm good regardless",rap,Better Together,-0.6,0.6,2021
174,175,Sethii Shmactt,"[Hook x2]
You say you got the dough where the chips at?
You say you got the poles where the sticks at?
Swear these niggas not with that
All these niggas do is chitchat

[Verse 1]
Strictly gang no new names
Big chop, got kick like shoe game, Shmack Talk
Lil bitch get passed off, niggas only bust when these niggas finna jack off
(Aye) And I swear these niggas fags
Working with the feds, they got a wire and a badge
I ain’t chasin on a bitch, I be chasin on a bag
And you know I do the dash when the bappies on my ass
(Aye) I be stuffing woods til they obese
Nigga you be rollin skimps, you have no heam
Green light, lil bitch we the gold team
Keyshia Cole with the wop make this hoe sing
(Aye) All you do is tell stories
I be outside, you in the house like Cory
(Bitch) Wet a nigga up like a cannonball
Ran off on the plug, shut him down like the power’s off
Big bands, like a nigga won the Powerball
Walk up in the party and I bet they playing all our songs
(Aye) Young niggas bitch we tapped in
Groupie hoes, all up on my dick, I blow her back in
Got these fuck niggas panicking
Press lines
Got these niggas froze like a mannequin
Off the dope, sky walking like i’m Anakin
Rich taker, playin with my life like I’m gambling
(Aye) All these niggas do is chit chat
Big ass blower, watch out it got a kickback
And these niggas always fibbing they ain’t with that
Bitch ass
I be with the shits, you gon sit back
[Hook x2]
You say you got the dough where the chips at?
You say you got the poles where the sticks at?
Swear these niggas not with that
All these niggas do is chitchat",rap,Fraud,-0.6,0.5,2018
178,179,Chiddy Bang,"[Introduction]
PSA: Now arriving in Philadelphia, the last stop. Thank you for riding the Swelly Express
Chiddy: Damn, yo I just woke up son. That was the craziest dream ever dawg. Black Thought came through and gave us some advice and got on the track. Some Hollywood shit

[Verse 1]
They waitin’ for that decline
Pray that I lose my mind, they never want me to shine
But I observe that, trouble I will serve that
Ear to the streets, never will I give the curve back
Still movin’ at a velocity
Still sensing the animosity
Hate mail is what they send me
But I separate letters like an apostrophe
Colossally, didn’t come the same must of had two angles
He was isosceles, but now I’m Socrates
With philosophies
I’m in my tree house please don’t bother me
And now it’s lookin’ like hella smoke
Under age they lettin’ me pass the velvet rope
And this life getting reckless
Feeling like a lone star, Texas
[Hook]
Uh huh I know what’s on your mind
You don’t think were gonna shine
I face you to prove you wrong
Thought I was weak I tell you I am getting strong
This time its gonna be different than the last time
I swear I’m gonna turn this from a hobby and a pastime
Tomorrow gonna be better than today (yeah)
This will wash the pain away

[Verse 2]
Could you cheer for me when you see me?
Had to follow my dreams and they cannot believe me
But, you see I need it for the cake I go
Like Today on the TV and the radio
Retro ’80 flow, hood make it crazy though
Puttin’ work with music but the school made me lazy though
Why cause I couldn’t write enough rhymes
They say that hip-hop is dead we bring the vital signs
Never trippin’, I’m on a different grind
Bring slaughter to your houses, a young Nickel-Nine
See, now tell me would ya get me wrong
If I told you in the studio I met Solange?
If I said I command it like its the Pentagon
Hatin’ on even on the roof I’m upper echelon
But still forever we shine
Turn a negative to positive I never decline
[Hook]",rap,Decline,0.9,0.6,2009
